,breed_id,Breed,breed_rank,BreedName,Group1,Group2,MaleWtKg,Temperment,AvgPupPrice,Intelligence,Watchdog,PopularityUS2017
0,1,Retrievers (Labrador),1,Black Labrador Retriever,Sporting,Gun,32.0,"Affectionate, Alert, Cheerful, Energetic, Friendly, Gentle, Intelligent, Loving, Loyal, Outgoing, Playful, Responsive, Social",1500.0,7.0,3.0,1.0
1,1,Retrievers (Labrador),1,Chocolate Labrador Retriever,Sporting,Gun,32.0,"Affectionate, Alert, Cheerful, Energetic, Friendly, Gentle, Intelligent, Loving, Loyal, Outgoing, Playful, Responsive, Social",1500.0,7.0,3.0,1.0
2,1,Retrievers (Labrador),1,Labrador Retriever,Sporting,Gun,32.0,"Affectionate, Alert, Cheerful, Energetic, Friendly, Gentle, Intelligent, Loving, Loyal, Outgoing, Playful, Responsive, Social",1500.0,7.0,3.0,1.0
3,1,Retrievers (Labrador),1,Yellow Labrador Retriever,Sporting,Gun,32.0,"Affectionate, Alert, Cheerful, Energetic, Friendly, Gentle, Intelligent, Loving, Loyal, Outgoing, Playful, Responsive, Social",1500.0,7.0,3.0,1.0
4,2,German Shepherd Dogs,2,German Shepherd Dog,Herding,Herding,35.0,"Alert, Confident, Courageous, Curious, Intelligent, Loyal, Obedient, Watchful",1400.0,3.0,6.0,2.0
5,2,German Shepherd Dogs,2,Shepherd,Herding,Herding,35.0,"Alert, Confident, Courageous, Curious, Intelligent, Loyal, Obedient, Watchful",1400.0,3.0,6.0,2.0
6,2,German Shepherd Dogs,2,White German Shepherd,Herding,Herding,35.0,"Alert, Confident, Courageous, Curious, Intelligent, Loyal, Obedient, Watchful",1400.0,3.0,6.0,2.0
7,3,Retrievers (Golden),3,Golden Retriever,Sporting,Gun,32.0,"Confident, Friendly, Intelligent, Kind, Reliable, Trustworthy",1500.0,4.0,3.0,3.0
8,3,Retrievers (Golden),3,Retriever,Sporting,Gun,32.0,"Confident, Friendly, Intelligent, Kind, Reliable, Trustworthy",1500.0,4.0,3.0,3.0
9,4,French Bulldogs,4,French Bulldog,Non Sporting,Companion,12.0,"Affectionate, Playful, Alert, Athletic, Bright, Easygoing, Keen, Lively, Patient",3000.0,58.0,3.0,4.0
10,5,Bulldogs,5,English Bulldog,Non Sporting,Companion,25.0,"Aggressive, Courageous, Friendly, Loving, Social, Sweet",1600.0,77.0,3.0,5.0
11,6,Beagles,6,Beagle,Hound,Scenthound,11.0,"Friendly, Gentle, Independent, Intelligent, Lively, Loving, Sweet",650.0,72.0,1.0,6.0
12,7,Poodles,7,Poodle,Non Sporting,Gun,26.0,"Active, Alert, Faithful, Instinctual, Intelligent, Trainable",1250.0,2.0,4.0,7.0
13,7,Poodles,7,Standard Poodle,Non Sporting,Gun,26.0,"Active, Alert, Faithful, Instinctual, Intelligent, Trainable",1250.0,2.0,4.0,7.0
14,8,Rottweilers,8,Rottweiler,Working,Guardian,51.0,"Alert, Courageous, Fearless, Good-natured, Independent, Intelligent, Loyal, Protective",1600.0,9.0,6.0,8.0
15,9,Yorkshire Terriers,9,Yorkshire Terrier Yorkie,Toy,Companion,3.0,"Alert, Courageous, Energetic, Independent, Intelligent, Loyal, Playful",800.0,27.0,3.0,9.0
16,10,Pointers (German Shorthaired),10,German Shorthaired Pointer,Working,Gun,29.0,"Affectionate, Boisterous, Bold, Cooperative, Intelligent, Trainable",700.0,17.0,3.0,10.0
17,11,Boxers,11,Boxer,Working,Guardian,30.0,"Brave, Bright, Confident, Energetic, Fearless, Friendly, Intelligent, Loyal, Playful",900.0,49.0,5.0,11.0
18,12,Siberian Huskies,12,Husky,Working,Northern,24.0,"Alert, Friendly, Gentle, Intelligent, Outgoing",950.0,45.0,1.0,12.0
19,12,Siberian Huskies,12,Siberian Husky,Working,Northern,24.0,"Alert, Friendly, Gentle, Intelligent, Outgoing",950.0,45.0,1.0,12.0
20,13,Dachshunds,13,Dachshund,Hound,Scenthound,7.0,"Clever, Courageous, Devoted, Lively, Playful, Stubborn",600.0,49.0,3.0,13.0
21,14,Great Danes,14,Great Dane,Working,Guardian,77.0,"Friendly, Confident, Devoted, Intelligent, Gentle, Loving, Reserved",1000.0,48.0,5.0,14.0
22,15,Pembroke Welsh Corgis,15,,,,,,,,,
23,16,Doberman Pinschers,16,Doberman Pinscher,Working,Guardian,43.0,"Alert, Energetic, Fearless, Intelligent, Loyal, Obedient",900.0,5.0,6.0,16.0
24,17,Australian Shepherds,17,Australian Shepherd,Terrier,Terrier,27.0,"Active, Affectionate, Friendly, Good-natured, Intelligent, Protective, Loving",700.0,42.0,5.0,17.0
25,18,Miniature Schnauzers,18,Miniature Schnauzer,Terrier,Companion,8.0,"Devoted, Good-natured, Intelligent, Lively, Playful, Trainable",800.0,,,18.0
26,19,Cavalier King Charles Spaniels,19,Cavalier King Charles Spaniel,Toy,Companion,7.0,"Affectionate, Cheerful, Courageous, Gentle, Intelligent, Social",1350.0,44.0,2.0,19.0
27,20,Shih Tzu,20,Shih Tzu,Toy,Companion,6.0,"Active, Courageous, Friendly, Gentle, Happy, Intelligent, Lively, Outgoing, Playful",1000.0,70.0,3.0,20.0
28,21,Boston Terriers,21,Boston Terrier,Non Sporting,Companion,9.0,"Affectionate, Aggressive, Friendly, Gentle, Intelligent, Lively, Playful",750.0,54.0,3.0,21.0
29,22,Pomeranians,22,Pomeranian,Toy,Companion,2.0,"Active, Extroverted, Friendly, Intelligent, Lively, Playful, Sociable",700.0,23.0,3.0,22.0
30,23,Havanese,23,Havanese,Toy,Companion,5.0,"Affectionate, Companionable, Gentle, Intelligent, Playful, Responsive",1050.0,,3.0,23.0
31,24,Shetland Sheepdogs,24,Shetland Sheepdog Sheltie,Herding,Herding,9.0,"Affectionate, Friendly, Gentle, Intelligent, Lively, Playful, Responsive",900.0,6.0,4.0,24.0
32,25,Bernese Mountain Dogs,25,Bernese Mountain Dog,Working,Guardian,44.0,"Affectionate, Faithful, Intelligent, Loyal",900.0,22.0,5.0,25.0
33,25,Bernese Mountain Dogs,25,Mountain Dog,Working,Guardian,44.0,"Affectionate, Faithful, Intelligent, Loyal",900.0,22.0,5.0,25.0
34,26,Brittanys,26,Brittany Spaniel,Sporting,Gun,17.0,"Alert, Independent, Intelligent, Responsive, Social",750.0,19.0,3.0,26.0
35,27,Spaniels (English Springer),27,English Springer Spaniel,Sporting,Gun,23.0,"Affectionate, Alert, Cheerful, Energetic, Intelligent, Playful, Social",750.0,13.0,3.0,27.0
36,28,Mastiffs,28,Mastiff,Working,Guardian,90.0,"Affectionate, Alert, Cheerful, Courageous, Intelligent, Loyal, Protective",1350.0,72.0,6.0,28.0
37,29,Spaniels (Cocker),29,Cocker Spaniel,Sporting,Gun,10.0,"Even Tempered, Joyful, Merry, Outgoing, Intelligent, Sociable, Trusting",700.0,20.0,3.0,29.0
38,29,Spaniels (Cocker),29,Spaniel,Sporting,Gun,10.0,"Even Tempered, Joyful, Merry, Outgoing, Intelligent, Sociable, Trusting",700.0,20.0,3.0,29.0
39,30,Vizslas,30,Vizsla,Sporting,Gun,21.0,"Affectionate, Cheerful, Energetic, Gentle, Intelligent, Playful, Protective, Quiet",1000.0,,3.0,30.0
40,31,Pugs,31,Pug,Toy,Companion,8.0,"Affectionate, Cheerful, Courageous, Gentle, Intelligent, Friendly, Outgoing, Playful, Loyal",400.0,57.0,3.0,31.0
41,32,Chihuahuas,32,Chihuahua,Toy,Companion,2.0,"Alert, Courageous, Devoted, Lively, Intelligent, Quick",700.0,67.0,2.0,32.0
42,33,Maltese,33,Maltese,Toy,Companion,4.0,"Active, Docile, Easygoing, Gentle, Intelligent, Playful, Responsive, Sweet-tempered",700.0,59.0,3.0,33.0
43,34,Weimaraners,34,Weimaraner,Sporting,Gun,29.0,"Alert, Aloof, Energetic, Fast, Intelligent, Powerful, Steady, Stubborn, Social",1750.0,21.0,3.0,34.0
44,35,Miniature American Shepherds,35,,,,,,,,,
45,36,Newfoundlands,36,Newfoundland Dog,Working,Guardian,65.0,"Cheerful, Courageous, Intelligent, Loyal, Social, Sweet, Gentle",1750.0,34.0,5.0,36.0
46,37,Cane Corso,37,Cane Corso Mastiff,Working,Guardian,47.0,"Cheerful, Courageous, Loyal, Quiet, Social",1750.0,,6.0,37.0
47,38,Border Collies,38,Border Collie,Herding,Herding,17.0,"Intelligent, Energetic, Alert, Responsive, Tenacious, Loyal, Protective",700.0,1.0,6.0,38.0
48,39,Basset Hounds,39,Basset Hound,Hound,Scenthound,26.0,"Affectionate, Devoted, Friendly, Gentle, Sweet-tempered, Tenacious",400.0,71.0,1.0,39.0
49,40,Collies,40,Collie,Herding,Herding,31.0,"Friendly, Gentle, Intelligent, Loyal, Protective, Responsive, Social",500.0,16.0,5.0,40.0
50,41,Rhodesian Ridgebacks,41,Rhodesian Ridgeback,Hound,Sight,39.0,"Dignified, Intelligent, Loyal, Mischevious, Sensitive, Strong-willed",1150.0,52.0,3.0,41.0
51,42,West Highland White Terriers,42,Terrier,Terrier,Terrier,8.0,"Affectionate, Alert, Courageous, Intelligent, Friendly, Hardy, Independent",1050.0,47.0,3.0,42.0
52,42,West Highland White Terriers,42,West Highland White Terrier Westie,Terrier,Terrier,8.0,"Affectionate, Alert, Courageous, Intelligent, Friendly, Hardy, Independent",1050.0,47.0,3.0,42.0
53,43,Retrievers (Chesapeake Bay),43,Chesapeake Bay Retriever,Sporting,Gun,33.0,"Happy, Affectionate, Dominant, Intelligent, Protective, Quiet",800.0,27.0,3.0,43.0
54,44,Belgian Malinois,44,Belgian Shepherd Malinois,Herding,Herding,27.0,"Active, Alert, Confident, Friendly, Hard-working, Protective, Stubborn, Watchful",700.0,,6.0,44.0
55,45,Shiba Inu,45,Shiba Inu,Non Sporting,Companion,10.0,"Alert, Charming, Confident, Faithful, Fearless, Keen, Outgoing",900.0,,4.0,45.0
56,46,Bichons Frises,46,Bichon Frise,Non Sporting,Companion,4.0,"Affectionate, Cheerful, Feisty, Gentle, Playful, Intelligent, Sensitive",850.0,45.0,3.0,46.0
57,47,Akitas,47,Akita,Working,Herding,44.0,"Alert, Courageous, Dignified, Docile, Friendly, Intelligent, Responsive",1000.0,54.0,5.0,47.0
58,48,St. Bernards,48,Saint Bernard,Working,Guardian,66.0,"Friendly, Gentle, Independent, Intelligent, Outgoing, Quiet, Social",1650.0,65.0,3.0,48.0
59,49,Soft Coated Wheaten Terriers,49,Wheaten Terrier,Terrier,Terrier,18.0,"Affectionate, Energetic, Faithful, Intelligent, Playful, Spirited",900.0,40.0,4.0,49.0
60,50,Bloodhounds,50,Bloodhound,Hound,Scenthound,46.0,"Affectionate, Even-tempered, Gentle, Stubborn, Independent",1000.0,74.0,1.0,50.0
61,51,Bullmastiffs,51,Bullmastiff,Working,Guardian,55.0,"Alert, Calm, Courageous, Devoted, Docile, Powerful, Loyal, Protective, Reliable",1350.0,69.0,6.0,51.0
62,52,Spaniels (English Cocker),52,English Cocker Spaniel,Sporting,Gun,14.0,"Affectionate, Faithful, Friendly, Intelligent, Playful, Quiet, Trainable",1050.0,18.0,4.0,52.0
63,53,Papillons,53,Papillon,Toy,Companion,5.0,"Alert, Energetic, Friendly, Happy, Hardy, Intelligent",500.0,8.0,3.0,53.0
64,54,Portuguese Water Dogs,54,Portuguese Water Dog,Working,Gun,22.0,"Brave, Docile, Impetuous, Intelligent, Obedient, Quarrelsome",2650.0,,4.0,54.0
65,55,Airedale Terriers,55,Airedale Terrier,Terrier,Terrier,26.0,"Alert, Confident, Courageous, Friendly, Intelligent, Outgoing",700.0,29.0,4.0,55.0
66,56,Australian Cattle Dogs,56,Australian Cattle Dog/Blue Heeler,Herding,Herding,21.0,"Aggressive, Alert, Energetic, Intelligent, Loyal, Protective, Responsive",600.0,10.0,6.0,56.0
67,56,Australian Cattle Dogs,56,Cattle Dog,Herding,Herding,21.0,"Aggressive, Alert, Energetic, Intelligent, Loyal, Protective, Responsive",600.0,10.0,6.0,56.0
68,57,Samoyeds,57,Samoyed,Working,Northern,26.0,"Alert, Lively, Friendly, Intelligent, Playful, Sociable, Stubborn",1350.0,33.0,4.0,57.0
69,58,Scottish Terriers,58,Scottish Terrier Scottie,Terrier,Terrier,9.0,"Independent, Fiesty, Alert, Playful, Quick, Self-assured",900.0,65.0,3.0,58.0
70,59,Alaskan Malamutes,59,Alaskan Malamute,Working,Northern,40.0,"Affectionate, Devoted, Dignified, Friendly, Loyal, Playful",1350.0,50.0,5.0,59.0
71,60,Bull Terriers,60,Bull Terrier,Terrier,Terrier,28.0,"Active, Keen, Protective, Sweet-tempered, Trainable",1350.0,66.0,6.0,60.0
72,61,Whippets,61,Whippet,Hound,Sight,16.0,"Affectionate, Friendly, Gentle, Intelligent, Lively, Quiet",1000.0,51.0,3.0,61.0
73,62,Pointers (German Wirehaired),62,German Wirehaired Pointer,Sporting,Gun,30.0,"Active, Affectionate, Friendly, Intelligent, Loyal, Willful, Responsive",800.0,44.0,6.0,62.0
74,63,Dalmatians,63,Dalmatian,Non Sporting,Companion,25.0,"Active, Energetic, Friendly, Intelligent, Outgoing, Playful, Sensitive",800.0,39.0,3.0,63.0
75,64,Chinese Shar-Pei,64,Shar Pei,Non Sporting,Northern,22.0,"Affectionate, Devoted, Independent, Loving, Reserved, Suspicious",1100.0,51.0,3.0,64.0
76,65,Wirehaired Pointing Griffons,65,Wire-haired Pointing Griffon,Sporting,Gun,25.0,"Gentle, Loyal, Proud, Trainable, Vigilant, Intelligent",700.0,46.0,5.0,65.0
77,66,Great Pyrenees,66,Great Pyrenees,Working,Guardian,45.0,"Affectionate, Confident, Fearless, Gentle, Patient, Strong-willed",800.0,64.0,6.0,66.0
78,67,Dogues de Bordeaux,67,Dogue de Bordeaux,Working,Guardian,60.0,"Companionable, Courageous, Devoted, Even-tempered, Loyal, Vigiliant",1150.0,,6.0,67.0
79,68,Cardigan Welsh Corgis,68,Corgi,Herding,Herding,13.0,"Active, Affectionate, Alert, Companionable, Devoted, Gentle, Intelligent",1100.0,26.0,4.0,68.0
80,68,Cardigan Welsh Corgis,68,Welsh Corgi,Herding,Herding,13.0,"Active, Affectionate, Alert, Companionable, Devoted, Gentle, Intelligent",1100.0,26.0,4.0,68.0
81,68,Cardigan Welsh Corgis,68,Cardigan,Herding,Herding,16.0,"Active, Affectionate, Alert, Companionable, Devoted, Gentle, Intelligent",1100.0,26.0,4.0,68.0
82,68,Cardigan Welsh Corgis,68,Pembroke,Herding,Herding,12.0,"Active, Affectionate, Alert, Companionable, Devoted, Gentle, Intelligent",1100.0,26.0,4.0,68.0
83,69,Cairn Terriers,69,Cairn Terrier,Terrier,Terrier,7.0,"Active, Assertive, Courageous, Fearless, Hardy, Intelligent",850.0,35.0,4.0,69.0
84,70,Old English Sheepdogs,70,Old English Sheepdog,Herding,Herding,39.0,"Adaptable, Bubbly, Intelligent, Loving, Playful, Sociable, Protective",1350.0,63.0,4.0,70.0
85,70,Old English Sheepdogs,70,Sheep Dog,Herding,Herding,39.0,"Adaptable, Bubbly, Intelligent, Loving, Playful, Sociable, Protective",1350.0,63.0,4.0,70.0
86,71,Miniature Pinschers,71,Miniature Pinscher,Toy,Companion,5.0,"Clever, Energetic, Friendly, Outgoing, Playful, Responsive, Intelligent",500.0,37.0,3.0,71.0
87,72,Setters (Irish),72,Irish Setter,Sporting,Gun,32.0,"Affectionate, Companionable, Energetic, Independent, Lively, Playful, Intelligent",900.0,35.0,3.0,72.0
88,73,Irish Wolfhounds,73,Irish Wolfhound,Hound,Scenthound,55.0,"Dignified, Generous, Loyal, Patient, Sweet-tempered, Thoughtful, Intelligent",1900.0,41.0,3.0,73.0
89,74,Italian Greyhounds,74,Italian Greyhound,Toy,Companion,4.0,"Affectionate, Agile, Athletic, Companionable, Intelligent, Mischevious",900.0,60.0,3.0,74.0
90,75,Greater Swiss Mountain Dogs,75,Greater Swiss Mountain Dog,Working,Guardian,60.0,"Alert, Devoted, Fearless, Good-natured, Protective, Self-confident",2250.0,,5.0,75.0
91,76,Chow Chows,76,Chow Chow,Non Sporting,Northern,26.0,"Aloof, Independent, Loyal, Quiet, Intelligent, Protective, Detached",700.0,76.0,3.0,76.0
92,77,Lhasa Apsos,77,Lhasa Apso,Non Sporting,Companion,6.0,"Alert, Assertive, Devoted, Friendly, Intelligent, Lively, Obedient, Playful, Spirited, Steady",600.0,68.0,3.0,77.0
93,78,Russell Terriers,78,Jack Russell Terrier,Terrier,Terrier,7.0,"Alert, Cheerful, Courageous, Energetic, Independent",850.0,,4.0,78.0
94,79,Chinese Crested,79,Chinese Crested Dog,Toy,Companion,4.0,"Affectionate, Alert, Happy, Lively, Playful, Sweet-tempered",900.0,61.0,2.0,79.0
95,80,Giant Schnauzers,80,Giant Schnauzer,Working,Companion,38.0,"Dominant, Intelligent, Kind, Loyal, Powerful, Strong-willed",1250.0,28.0,6.0,80.0
96,80,Giant Schnauzers,80,Giant Schnauzer,Working,Herding,31.0,"Devoted, Good-natured, Intelligent, Lively, Playful, Trainable",1250.0,,,80.0
97,81,Coton de Tulear,81,Coton de Tulear,Non Sporting,Companion,6.0,"Affectionate, Intelligent, Lively, Playful, Trainable, Vocal",2700.0,,3.0,81.0
98,82,Staffordshire Bull Terriers,82,Staffordshire Bull Terrier,Terrier,Terrier,14.0,"Affectionate, Bold, Courageous, Fearless, Intelligent, Reliable",1750.0,49.0,3.0,82.0
99,83,American Staffordshire Terriers,83,American Staffordshire Terrier,Terrier,Terrier,28.0,"Attentive, Courageous, Devoted, Friendly, Loyal, Tenacious, Intelligent",900.0,34.0,3.0,83.0
100,84,Basenjis,84,Basenji,Hound,Sight,11.0,"Affectionate, Alert, Curious, Energetic, Playful, Intelligent",1100.0,78.0,5.0,84.0
101,85,Bouviers des Flandres,85,Bouvier des Flanders,Herding,Herding,42.0,"Familial, Gentle, Intelligent, Loyal, Protective, Rational",1750.0,29.0,5.0,85.0
102,86,Anatolian Shepherd Dogs,86,Anatolian Shepherd,Working,Guardian,52.0,"Bold, Confident, Independent, Intelligent, Proud, Steady",800.0,,6.0,86.0
103,87,Keeshonden,87,Keeshond,Non Sporting,Northern,18.0,"Agile, Bright, Obedient, Playful, Quick, Sturdy, Intelligent",900.0,16.0,4.0,87.0
104,88,Pekingese,88,Pekingese,Toy,Companion,4.0,"Affectionate, Aggressive, Good-natured, Intelligent, Opinionated, Stubborn",700.0,73.0,3.0,88.0
105,89,Retrievers (Nova Scotia Duck Tolling),89,Nova Scotia Duck-Tolling Retriever,Sporting,Gun Dogs,20.0,"Affectionate, Alert, Courageous, Energetic, Gentle, Playful, Responsive",1900.0,,5.0,89.0
106,90,Standard Schnauzers,90,Schnauzer,Working,Herding,17.0,"Devoted, Good-natured, Intelligent, Lively, Playful, Trainable",1350.0,18.0,4.0,90.0
107,91,Norwegian Elkhounds,91,Norwegian Elkhound,Hound,Northern,26.0,"Alert, Bold, Hardy, Loyal, Playful, Strong-willed, Intelligent",600.0,36.0,6.0,91.0
108,92,Border Terriers,92,Border Terrier,Terrier,Terrier,7.0,"Affectionate, Alert, Even-tempered, Fearless, Intelligent, Obedient",1300.0,30.0,4.0,92.0
109,93,Afghan Hounds,93,Afghan Hound,Sporting,Sight,28.0,"Aloof, Clownish, Dignified, Happy, Independent",2250.0,79.0,1.0,93.0
110,94,Brussels Griffons,94,Brussels Griffon,Toy,Companion,4.0,"Alert, Companionable, Inquisitive, Self-important, Sensitive, Watchful",900.0,,3.0,94.0
111,95,Setters (English),95,English Setter,Sporting,Gun,30.0,"Strong-willed, Mischevious, Gentle, Energetic, Intelligent",500.0,37.0,3.0,95.0
112,95,Setters (English),95,Setter,Sporting,Gun,30.0,"Strong-willed, Mischevious, Gentle, Energetic, Intelligent",500.0,37.0,3.0,95.0
113,96,Retrievers (Flat-Coated),96,Flat-coated Retriever,Sporting,Gun,30.0,"Friendly, Confident, Devoted, Optimistic, Outgoing, Intelligent",1100.0,18.0,5.0,96.0
114,97,Rat Terriers,97,Rat Terrier,Terrier,Terrier,11.0,"Affectioante, Alert, Inquisitive, Lively, Loving",400.0,,3.0,97.0
115,98,Spaniels (Boykin),98,Boykin Spaniel,Sporting,Gun,15.0,"Companionable, Eager, Energetic, Friendly, Intelligent, Trainable",900.0,,3.0,98.0
116,99,Fox Terriers (Wire),99,Wire Fox Terrier,Terrier,Terrier,7.0,"Alert, Bold, Fearless, Friendly, Keen, Quick, Intelligent",900.0,51.0,3.0,99.0
117,99,Fox Terriers (Wire),99,Wirehaired Terrier,Terrier,Terrier,7.0,"Alert, Bold, Fearless, Friendly, Keen, Quick, Intelligent",900.0,51.0,3.0,99.0
118,100,Leonbergers,100,Leonberger,Working,Guardian,64.0,"Adaptable, Companionable, Fearless, Loving, Loyal, Obedient",1750.0,,5.0,100.0
119,101,Tibetan Terriers,101,Tibetan Terrier,Non Sporting,Companion,10.0,"Affectionate, Amiable, Energetic, Gentle, Reserved, Sensitive, Intelligent",1600.0,62.0,3.0,101.0
120,102,Borzois,102,Borzoi,Hound,Sight,41.0,"Athletic, Gentle, Independent, Intelligent, Quiet, Respectful",1100.0,75.0,1.0,102.0
121,103,Belgian Tervuren,103,Belgian Shepherd Tervuren,Herding,Herding,34.0,"Alert, Attentive, Energetic, Intelligent, Loyal, Protective",1350.0,14.0,6.0,103.0
122,104,Setters (Gordon),104,Gordon Setter,Sporting,Gun,31.0,"Alert, Confident, Eager, Fearless, Loyal, Intelligent",900.0,34.0,4.0,104.0
123,105,Norwich Terriers,105,Norwich Terrier,Terrier,Terrier,5.0,"Affectionate, Energetic, Hardy, Intelligent, Sensitive",1700.0,38.0,3.0,105.0
124,106,Silky Terriers,106,Silky Terrier,Toy,Terrier,5.0,"Alert, Friendly, Inquisitive, Joyful, Quick, Responsive, Intelligent",700.0,37.0,3.0,106.0
125,107,Neapolitan Mastiffs,107,Neapolitan Mastiff,Working,Guardian,60.0,"Protective, Dominant, Fearless, Obedient, Stubborn, Trainable",1750.0,,6.0,107.0
126,108,Japanese Chin,108,Japanese Chin,Toy,Companion,5.0,"Alert, Cat-like, Independent, Intelligent, Loving, Loyal, Playful",400.0,62.0,3.0,108.0
127,109,Welsh Terriers,109,Welsh Terrier,Terrier,Terrier,9.0,"Alert, Friendly, Intelligent, Spirited, Independent, Loving",1000.0,53.0,3.0,109.0
128,110,Schipperkes,110,Schipperke,Non Sporting,Companion,7.0,"Agile, Confident, Curious, Faithful, Fearless, Independent, Intelligent",800.0,15.0,3.0,110.0
129,111,Spinoni Italiani,111,Italian Spinone,Sporting,Gun,33.0,"Friendly, Loyal, Affectionate, Docile, Gentle, Patient",1750.0,,3.0,111.0
130,112,Toy Fox Terriers,112,Toy Fox Terrier,Toy,Terrier,2.0,"Alert, Friendly, Intelligent, Loyal, Playful, Spirited",500.0,,2.0,112.0
131,113,Pointers,113,English Pointer,Sporting,Gun,25.0,"Active, Affectionate, Amiable, Even-tempered, Kind, Loyal, Intelligent",450.0,43.0,4.0,113.0
132,113,Pointers,113,Pointer,Sporting,Gun,25.0,"Active, Affectionate, Amiable, Even-tempered, Kind, Loyal, Intelligent",450.0,43.0,4.0,113.0
133,114,Irish Terriers,114,Irish Terrier,Terrier,Terrier,12.0,"Dominant, Intelligent, Lively, Protective, Respectful, Trainable",700.0,53.0,5.0,114.0
134,115,Miniature Bull Terriers,115,,,,,,,,,
135,116,Black Russian Terriers,116,Black Russian Terrier,Working,Guardian,51.0,"Brave, Confident, Energetic, Hardy, Lively, Stable",2150.0,,6.0,116.0
136,117,Lagotti Romagnoli,117,,,,,,,,,
137,118,American Eskimo Dogs,118,American Eskimo Dog,Non Sporting,Northern,8.0,"Alert, Energetic, Friendly, Independent, Intelligent, Protective",700.0,,4.0,118.0
138,118,American Eskimo Dogs,118,Eskimo Dog,Non Sporting,Northern,8.0,"Alert, Energetic, Friendly, Independent, Intelligent, Protective",700.0,,4.0,118.0
139,118,American Eskimo Dogs,118,German Spitz,Non Sporting,Northern,8.0,"Alert, Energetic, Friendly, Independent, Intelligent, Protective",700.0,,4.0,118.0
140,118,American Eskimo Dogs,118,Spitz,Non Sporting,Northern,8.0,"Alert, Energetic, Friendly, Independent, Intelligent, Protective",700.0,,4.0,118.0
141,119,Parson Russell Terriers,119,Jack Russell Terrier (Parson Russell Terrier),Terrier,Terrier,7.0,"Energetic, Bold, Eager, Happy, Intelligent, Obedient",500.0,,3.0,119.0
142,120,Belgian Sheepdogs,120,Belgian Shepherd Dog Sheepdog,Herding,Herding,32.0,"Active, Alert, Confident, Friendly, Hard-working, Protective, Stubborn, Watchful, Intelligent",1300.0,15.0,6.0,120.0
143,121,Tibetan Spaniels,121,Tibetan Spaniel,Non Sporting,Companion,6.0,"Intelligent, Assertive, Aloof, Happy, Independent, Willful",900.0,46.0,4.0,121.0
144,122,Fox Terriers (Smooth),122,Fox Terrier,Terrier,Terrier,8.0,"Active, Affectionate, Alert, Fearless, Intelligent, Playful",850.0,40.0,3.0,122.0
145,122,Fox Terriers (Smooth),122,Smooth Fox Terrier,Terrier,Terrier,8.0,"Active, Affectionate, Alert, Fearless, Intelligent, Playful",850.0,40.0,3.0,122.0
146,123,Salukis,123,Saluki,Hound,Sight,21.0,"Aloof, Intelligent, Quiet, Reserverd, Loyal",700.0,43.0,3.0,123.0
147,124,Boerboels,124,Boerboel,Working,Guardian,80.0,"Confident, Dominant, Intelligent, Obedient, Territorial",1750.0,,6.0,124.0
148,125,Bearded Collies,125,Bearded Collie,Herding,Herding,23.0,"Active, Alert, Hardy, Intelligent, Lively, Self-confident",1300.0,34.0,4.0,125.0
149,126,American Hairless Terriers,126,American Hairless Terrier,Terrier,Terrier,5.0,"Alert, Lively, Loving, Intelligent, Inquisitive, Playful",400.0,,3.0,126.0
150,127,Briards,127,Briard,Herding,Gun,35.0,"Faithful, Fearless, Intelligent, Loyal, Obedient, Protective",1100.0,30.0,6.0,127.0
151,128,Norfolk Terriers,128,Norfolk Terrier,Terrier,Terrier,5.0,"Companionable, Fearless, Happy, Lovable, Self-confident, Spirited, Intelligent",2250.0,56.0,3.0,128.0
152,129,Kerry Blue Terriers,129,Kerry Blue Terrier,Terrier,Terrier,17.0,"Affectionate, Alert, Gentle, Loyal, Spirited, Strong-willed, Intelligent",550.0,35.0,5.0,129.0
153,130,Black and Tan Coonhounds,130,Black and Tan Coonhound,Hound,Scenthound,55.0,"Adaptable, Easygoing, Even-tempered, Gentle, Lovable, Trusting, Intelligent",350.0,44.0,3.0,130.0
154,130,Black and Tan Coonhounds,130,Coonhound,Hound,Scenthound,55.0,"Adaptable, Easygoing, Even-tempered, Gentle, Lovable, Trusting, Intelligent",350.0,44.0,3.0,130.0
155,131,Treeing Walker Coonhounds,131,Treeing Walker Coonhound,Hound,Scenthound,28.0,"Affectionate, Clever, Confident, Loving, Trainable",500.0,,3.0,131.0
156,132,Bluetick Coonhounds,132,Bluetick Coonhound,Hound,Scenthound,28.0,"Friendly, Active, Gentle",550.0,,1.0,132.0
157,133,Spaniels (Welsh Springer),133,Welsh Springer Spaniel,Sporting,Gun,18.0,"Affectionate, Loyal, Active, Friendly, Playful, Stubborn, Intelligent",1300.0,31.0,4.0,133.0
158,134,English Toy Spaniels,134,English Toy Spaniel,Toy,Companion,5.0,"Affectionate, Gentle, Happy, Loving, Playful, Reserved",1400.0,,3.0,134.0
159,135,Manchester Terriers,135,Manchester Terrier,Terrier,Terrier,6.0,"Active, Alert, Devoted, Discerning, Quiet, Loyal, Intelligent",800.0,32.0,3.0,135.0
160,136,German Pinschers,136,German Pinscher,Working,Terrier,14.0,"Even-tempered, Familial, Courageous, Lively, Loving, Spirited",1500.0,,6.0,136.0
161,137,Australian Terriers,137,Australian Terrier,Terrier,Terrier,5.0,"Alert, Compassionate, Courageous, Even Tempered, Loyal, Spirited, Intelligent",1250.0,34.0,3.0,137.0
162,138,Lakeland Terriers,138,Lakeland Terrier,Terrier,Terrier,8.0,"Independent, Bold, Confident, Friendly, Intelligent, Trainable",1500.0,62.0,3.0,138.0
163,139,Redbone Coonhounds,139,Redbone Coonhound,Hound,Scenthound,28.0,"Affectionate, Companionable, Energetic, Familial, Independent, Unflappable",700.0,,1.0,139.0
164,140,Spaniels (Clumber),140,Clumber Spaniel,Sporting,Gun,32.0,"Gentle, Loyal, Affectionate, Dignified, Aloof",1000.0,37.0,3.0,140.0
165,141,Beaucerons,141,Beauceron,Herding,Herding,50.0,"Courageous, Obedient, Loyal, Protective, Loving",1350.0,,5.0,141.0
166,142,Pulik,142,Puli,Herding,Herding,14.0,"Agile, Energetic, Faithful, Intelligent, Loyal, Obedient",1100.0,27.0,5.0,142.0
167,143,Xoloitzcuintli,143,Xoloitzcuintle/Mexican Hairless,Non Sporting,Sight,11.0,"Aleret, Calm, Cheerful, Companionable, Loyal, Protective",700.0,,3.0,143.0
168,144,Icelandic Sheepdogs,144,,,,,,,,,
169,145,Spaniels (Field),145,Field Spaniel,Sporting,Gun,19.0,"Adaptable, Cautious, Docile, Familial, Sensitive, Sociable",900.0,34.0,3.0,145.0
170,146,Berger Picards,146,,,,,,,,,
171,147,Affenpinschers,147,Affenpinscher,Toy,Companion,4.0,"Active, Adventurous, Curious, Fun-loving, Playful, Stubborn",1000.0,37.0,1.0,147.0
172,148,Spanish Water Dogs,148,,,,,,,,,
173,149,Swedish Vallhunds,149,Swedish Vallhund,Herding,Herding,13.0,"Alert, Energetic, Fearless, Friendly, Watchful",800.0,,4.0,149.0
174,150,Sealyham Terriers,150,Sealyham Terrier,Terrier,Terrier,9.0,"Alert, Calm, Even-tempered, Fearless, Friendly, Intelligent",900.0,56.0,3.0,150.0
