175,151,Bedlington Terriers,151,Bedlington Terrier,Terrier,Terrier,9.0,"Affectionate, Devoted, Energetic, Loyal, Playful, Reliable, Intelligent",1900.0,40.0,3.0,151.0
176,152,Entlebucher Mountain Dogs,152,Entlebucher,Herding,Guardian,27.0,"Agile, Devoted, Independent, Loyal, Self-confident",,,6.0,152.0
177,153,Tibetan Mastiffs,153,Tibetan Mastiff,Working,Guardian,71.0,"Aloof, Protective, Strong-willed, Stubborn, Courageous, Loyal",3000.0,,6.0,153.0
178,154,Setters (Irish Red and White),154,,,,,,,,,
179,155,Wirehaired Vizslas,155,,,,,,,,,
180,156,Greyhounds,156,Greyhound,Hound,Sight,33.0,"Intelligent, Gentle, Affectionate, Athletic, Even-tempered, Quiet",650.0,46.0,3.0,156.0
181,157,Kuvaszok,157,Kuvasz,Working,Guardian,49.0,"Clownish, Independent, Intelligent, Loyal, Patient, Protective",1350.0,42.0,6.0,157.0
182,158,Glen of Imaal Terriers,158,Glen of Imaal Terrier,Terrier,Terrier,16.0,"Active, Agile, Courageous, Gentle, Loyal, Spirited",900.0,,3.0,158.0
183,159,Portuguese Podengo Pequenos,159,Podengo Portugueso,Hound,Sight,5.0,"Active, Companionable, Friendly, Hardy, Lively, Loyal",900.0,,3.0,159.0
184,160,Petits Bassets Griffons Vendeens,160,Petit Basset Griffon Vendeen,Hound,Scenthound,16.0,"Active, Extroverted, Friendly, Happy, Independent, Lively, Intelligent",1400.0,62.0,3.0,160.0
185,161,Spaniels (Sussex),161,Sussex Spaniel,Sporting,Gun,19.0,"Calm, Cheerful, Companionable, Devoted, Friendly, Sociable",2500.0,,3.0,161.0
186,162,Pumi,162,Pumi,Herding,Herding,13.0,"Active, Intelligent, Lively, Protective, Reserved, Vocal",2750.0,,3.0,162.0
187,163,Komondorok,163,Komondor,Working,Guardian,59.0,"Affectionate, Calm, Fearless, Gentle, Independent, Steady",1000.0,,6.0,163.0
188,164,Spaniels (Irish Water),164,Irish Water Spaniel,Sporting,Gun,25.0,"Active, Alert, Clownish, Inquisitive, Intelligent, Quick",900.0,24.0,4.0,164.0
189,165,Ibizan Hounds,165,Ibizan Hound,Hound,Sight,22.0,"Active, Clownish, Engaging, Independent, Intelligent, Stubborn",1000.0,53.0,3.0,165.0
190,166,Plotts,166,Plott Hound,Hound,Scenthound,26.0,"Alert, Bold, Courageous, Loyal",400.0,,3.0,166.0
191,167,Spaniels (American Water),167,American Water Spaniel,Sporting,Gun,16.0,"Energetic, Friendly, Intelligent, Obedient, Protective, Trainable",900.0,44.0,4.0,167.0
192,168,Scottish Deerhounds,168,Scottish Deerhound,Hound,Sight,42.0,"Dignified, Docile, Friendly, Gentle, Polite, Quiet",1100.0,47.0,1.0,168.0
193,169,Lowchen,169,Lowchen,Non Sporting,Companion,6.0,"Active, Familial, Friendly, Happy, Playful",400.0,,3.0,169.0
194,170,Norwegian Buhunds,170,Norwegian Buhund,Herding,Northern,16.0,"Agile, Courageous, Energetic, Friendly, Fun-loving",900.0,,4.0,170.0
195,171,Retrievers (Curly-Coated),171,Curly-Coated Retriever,Sporting,Gun,34.0,"Clever, Independent, Intelligent, Lively, Sensitive, Trainable",700.0,41.0,3.0,171.0
196,172,Skye Terriers,172,Skye Terrier,Terrier,Terrier,17.0,"Loyal, Fearless, Friendly, Good-tempered, Intelligent",800.0,55.0,4.0,172.0
197,173,Finnish Lapphunds,173,Finnish Lapphund,Herding,Northern,18.0,"Calm, Courageous, Faithful, Friendly, Keen",700.0,,5.0,173.0
198,174,Pharaoh Hounds,174,Pharaoh Hound,Hound,Sight,23.0,"Active, Affectionate, Intelligent, Playful, Sociable, Trainable",1900.0,37.0,2.0,174.0
199,175,Canaan Dogs,175,Canaan Dog,Herding,Sight,21.0,"Alert, Cautious, Devoted, Quick, Vigilant",1000.0,,3.0,175.0
200,176,Polish Lowland Sheepdogs,176,Polish Lowland Sheepdog,Herding,Herding,19.0,"Agile, Even-tempered, Lively, Perceptive, Self-confident",1750.0,,6.0,176.0
201,177,Finnish Spitz,177,Finnish Spitz,Non Sporting,Northern,15.0,"Happy, Independent, Intelligent, Loyal, Playful, Vocal",600.0,43.0,3.0,177.0
202,178,American English Coonhounds,178,English Coonhound,Hound,Scenthound,26.0,"Active, Energetic, High-strung, Loyal",1100.0,,4.0,178.0
203,179,Chinooks,179,Chinook,Working,Northern,32.0,"Alert, Calm, Dignified, Friendly, Responsive",900.0,,4.0,179.0
204,180,Pyrenean Shepherds,180,,,,,,,,,
205,181,Bergamasco Sheepdogs,181,,,,,,,,,
206,182,Dandie Dinmont Terriers,182,Dandi Dinmont Terrier,Terrier,Terrier,10.0,"Affectionate, Companionable, Determined, Fun-loving, Independent, Lively, Intelligent",1500.0,62.0,3.0,182.0
207,183,Harriers,183,Harrier,Hound,Scenthound,22.0,"Active, Cheerful, Friendly, Outgoing, Sweet-tempered, Tolerant",350.0,,2.0,183.0
208,184,Cirnechi dell’Etna,184,Cirneco dell'Etna,Hound,Sight,11.0,"Affectionate, Gentle, Lively",900.0,,3.0,184.0
209,185,Cesky Terriers,185,,,,,,,,,
210,186,Otterhounds,186,Otterhound,Hound,Scenthound,41.0,"Amiable, Boisterous, Even-tempered",550.0,46.0,2.0,186.0
211,187,American Foxhounds,187,Foxhound,Hound,Scenthound,32.0,"Independent, Intelligent, Kind, Loving, Loyal, Sweet-tempered",500.0,46.0,2.0,187.0
212,187,American Foxhounds,187,Hound,Hound,Scenthound,32.0,"Independent, Intelligent, Kind, Loving, Loyal, Sweet-tempered",500.0,46.0,2.0,187.0
213,188,Sloughis,188,Sloughi,Hound,Sight,28.0,"Alert, Faithful, Intelligent, Sensitive, Independent, Playful, Sweet",900.0,,5.0,188.0
214,189,English Foxhounds,189,,,,,,,,,
215,190,Norwegian Lundehunds,190,Norwegian Lundehund,Non Sporting,Northern,8.0,"Alert, Energetic, Loyal, Protective",500.0,,4.0,190.0
